{
  "algorithm": "ridge_regression_split_conformal",
  "colorSpace": "CIELAB_D65",
  "featureList": [
    "l_star",
    "a_star",
    "b_star",
    "b_over_l",
    "a_over_b"
  ],
  "minAppVersion": "1.0.0",
  "modelVersion": "1.0.0-synthetic",
  "multiSiteWeights": {
    "forehead": 0.4,
    "sternum": 0.6
  },
  "sites": {
    "forehead": {
      "intercept": 11.74411765,
      "residualQuantile90": 1.77018382,
      "ridgeCoefficients": [
        -1.34190136,
        -0.2481325,
        4.58332086,
        0.5200284,
        0.28847872
      ],
      "standardizationMeans": [
        51.40131433,
        10.43761779,
        29.83589764,
        0.60033748,
        0.35815678
      ],
      "standardizationScales": [
        9.97608849,
        1.92655211,
        4.96271877,
        0.14586868,
        0.08293825
      ]
    },
    "sternum": {
      "intercept": 11.74411765,
      "residualQuantile90": 2.16950738,
      "ridgeCoefficients": [
        -0.91212254,
        -1.07157647,
        4.85320648,
        1.05100244,
        1.31162312
      ],
      "standardizationMeans": [
        52.18830127,
        10.26508589,
        29.06602283,
        0.57501619,
        0.36206242
      ],
      "standardizationScales": [
        10.00023847,
        1.95391491,
        4.96609148,
        0.13791352,
        0.08701961
      ]
    }
  },
  "trainingDataSummary": {
    "description": "SYNTHETIC NON-CLINICAL MODEL ONLY. NOT FOR CLINICAL USE. Generated from calibrated bench phantoms to prove deterministic pipeline execution, golden vector parity, and split-conformal 90% prediction intervals.",
    "devices": [
      "Benchmark camera Helio G85",
      "Floor Android Go 2GB",
      "Redmi 14C"
    ],
    "metrics": {
      "correlationPearson": 0.98,
      "coverage90": 0.98,
      "mae": 0.82
    },
    "participantCount": 150,
    "populations": [
      "Synthetic bench phantoms (Fitzpatrick IV-VI)"
    ],
    "sampleCount": 225,
    "trainedDate": "2026-10-18"
  },
  "units": "mg/dL"
}
